{
  "$schema": "http://json-schema.org/draft-07/schema#",
  "title": "ScriptChain",
  "type": "object",
  "properties": {
    "chain_id": {"type": "string"},
    "nodes": {
      "type": "array",
      "items": {"$ref": "node_config.schema.json"}
    },
    "levels": {
      "type": "object",
      "patternProperties": {
        "^[0-9]+$": {
          "type": "array",
          "items": {"type": "string"}
        }
      }
    },
    "max_parallel": {"type": "integer"},
    "persist_intermediate_outputs": {"type": "boolean"},
    "global_context_manager": {"type": "object"},
    "callbacks": {
      "type": "array",
      "items": {"type": "string"}
    },
    "metrics": {"type": "object"},
    "metadata": {"$ref": "script_chain_metadata.schema.json"}
  },
  "required": ["chain_id", "nodes", "levels", "max_parallel", "persist_intermediate_outputs"]
} 